{
  "total_tests": 9,
  "format_valid_count": 9,
  "format_valid_rate": 100.0,
  "average_score": 88.88888888888889,
  "min_score": 0,
  "max_score": 100,
  "test_results": [
    {
      "email_id": "no_tasks_informational",
      "description": "Informational email with no actual tasks",
      "format_valid": true,
      "validation_message": "Valid format",
      "email_content": "נשלח: 2024-01-15 14:30\nמאת: daniel.manager@techcorp.co.il\nאל: development-team@techcorp.co.il, design-team@techcorp.co.il, qa-team@techcorp.co.il\nנושא: דוח שבועי - הישגים וסטטיסטיקות רבעון ראשון\n\nצוות יקר,\n\nאני שמח לחלוק אתכם את הדוח השבועי המפורט על הישגי החברה והצוותים השונים. השבוע שחלף היה אחד השבועות המוצלחים ביותר שלנו השנה, ואני רוצה לשתף אתכם בנתונים המרשימים.\n\nהישגי המכירות והלקוחות:\nהמכירות עלו ב-23% השבוע לעומת השבוע הקודם, עם סה\"כ הכנסות של 2.4 מיליון שקל. הלקוחות החדשים שרכשנו השבוע כוללים שלוש חברות גדולות מהיי-טק: אינטל ישראל, מיקרוסופט ישראל וחברת CheckPoint. כל הלקוחות הביעו שביעות רצון גבוהה מהשירות שלנו ומהמהירות בהטמעת הפתרונות.\n\nהישגי הפיתוח:\nצוות הפיתוח השלים בהצלחה את הגרסה החדשה של המערכת, כולל שיפורים משמעותיים בביצועים (40% שיפור במהירות), תיקון 47 באגים קריטיים ותוספת 12 פיצ'רים חדשים. הבדיקות האוטומטיות עברו בהצלחה עם 98.7% כיסוי קוד.\n\nהישגי העיצוב והממשק:\nצוות העיצוב סיים את העבודה על הממשק החדש לאפליקציית הסלולר, והתוצאות מבדיקות המשתמשים מראות שיפור של 45% בחוויית המשתמש. הדירוג באפ סטור עלה מ-3.2 ל-4.6 כוכבים.\n\nהישגי QA ובדיקות:\nצוות האיכות ביצע השבוע מעל 500 בדיקות מקיפות, וזיהה ותיקן 23 באגים לפני השחרור לייצור. זמן הטיפול הממוצע בבאגים ירד ל-4.2 שעות.\n\nסטטיסטיקות כלליות:\n- זמן אבטחה במערכות: 99.97% (יעד חודשי: 99.5%)\n- שביעות רצון לקוחות: 94% (יעד רבעוני: 90%)\n- זמן תגובה ממוצע לקריאות: 12 דקות (יעד: 15 דקות)\n- עמידה בלוחות זמנים: 97% מהפרויקטים נמסרו בזמן\n\nבנוסף, אני שמח לבשר שקיבלנו השבוע הודעה רשמית על זכייתנו בפרס \"חברת הסטארט-אפ הטובה ביותר לשנת 2024\" מטעם לשכת המסחר תל-אביב. זהו הישג מדהים שמשקף את המסירות והמקצועיות של כל אחד ואחת מכם.\n\nהודעות חשובות:\nהמשרדים יהיו סגורים ביום שישי הבא (19.1) עקב יום עיון כלל-חברתי. ביום ראשון נחזור לשגרה רגילה. ביום שלישי הבא תתקיים מסיבת חג המולד המאוחרת במשרדי החברה.\n\nתוכניות לשבוע הבא:\nהשבוע הבא נתמקד בהכנות לתערוכת ההיי-טק הגדולה בחודש פברואר, וכן נתחיל בעבודה על הפרויקט החדש עם החברה האמריקאית. פרטים נוספים יישלחו בתחילת השבוע.\n\nאני רוצה להודות לכל אחד ואחת מכם על העבודה המסורה, הקריאטיביות והמקצועיות שאתם מפגינים מדי יום. אתם הסיבה להצלחות האלה, ואני גאה להיות חלק מהצוות הזה.\n\nסוף שבוע נעים לכולם!\nבברכה והערכה רבה,\nדניאל כהן\nמנהל כללי",
      "extracted_tasks": [],
      "num_tasks_extracted": 0,
      "score": 0,
      "judgment": "ציון: 0\nנקודות חולשה: המערכת לא זיהתה אף משימה באימייל.\nהמשימות הקיימות במייל: []",
      "model_used": "gpt-3.5-turbo"
    },
    {
      "email_id": "multiple_tasks_different_people",
      "description": "Email with multiple tasks assigned to different people",
      "format_valid": true,
      "validation_message": "Valid format",
      "email_content": "נשלח: 2024-01-20 16:45\nמאת: amit.haran@fintech-innovations.co.il\nאל: development-team@fintech-innovations.co.il, design-team@fintech-innovations.co.il\nנושא: [דחוף] משימות אפליקציית הבנקאות החדשה\n\nצוות יקר,\n\nלאחר הפגישה עם הנהלת הבנק, אנו מקדמים את משיקת האפליקציה החדשה לחודש מרץ. זהו פרויקט אסטרטגי בשווי 12 מיליון שקל והצלחתו קריטית לעתיד החברה.\n\nבתחום העיצוב, נצטרך שמיכל תשלים את כל ממשקי המשתמש עד יום חמישי 25.1.2024 בשעה 17:00. הדרישות כוללות עיצוב מחדש של מסך הכניסה עם אבטחה ביומטרית, ממשק ההעברות החדש עם אישור דו-שלבי, דשבורד המציג יתרות וגרפים, מסכי הלוואות וחיסכון עם חישובי ריבית דינמיים, וממשק לשירותי לקוחות עם צ'אט בוט חכם. כל הממשקים צריכים להיות responsive ותואמים ל-WCAG 2.1. בנוסף, אני מצפה שעדי יסיים את האיקונוגרפיה החדשה ומערכת הצבעים עד יום רביעי 24.1.2024, ויכין prototypes אינטראקטיביים ב-Figma לכל התהליכים המרכזיים.\n\nמצד הפיתוח, דוד יטפל בארכיטקטורה הטכנית ופיתוח ה-API החדש עד יום ראשון 28.1.2024. הוא יצטרך לבנות REST API עם אבטחת OAuth 2.0, WebSocket connections למעקב real-time, מיקרו-שירותים לחיבור למערכות הבנק, מערכת notifications עם Firebase, ואלגוריתמי ML לזיהוי עסקאות חשודות. במקביל, תמר תטפל בצד הקליינט React Native ותבטיח אינטגרציה מלאה עד יום שישי 26.1.2024. התפקיד שלה יכלול פיתוח רכיבי UI מותאמים אישית, מנגנון caching חכם, הטמעת התחברות ביומטרית, וטיפול בחריגות ומצבי שגיאה.\n\nבנושא האבטחה, יונתן יהיה אחראי על כל המערכות עד יום חמישי 25.1.2024. המשימות שלו כוללות הטמעת תקני PCI DSS, הגדרת מערכת logging עם ELK Stack, ביצוע בדיקות penetration testing, והגדרת CI/CD pipeline עם Docker ו-Kubernetes.\n\nמבחינת ניהול המוצר, נדרשת מצגת מקיפה לדירקטוריון שאצטרך שרה תכין עד מחר 21.1.2024 בשעה 10:00. המצגת חייבת לכלול אבני דרך מפורטות, ניתוח תחרותי של אפליקציות בנקאיות מובילות, תחזיות הכנסות ו-ROI, אסטרטגיית שיווק ורכישת לקוחות, וניתוח סיכונים. באיכות, רועי יכין תוכנית בדיקות מקיפה עד יום רביעי 24.1.2024, כולל test cases לכל התהליכים העסקיים, תרחישי עומס עד 100,000 משתמשים במקביל, בדיקות אבטחה, ומדריכי QA.\n\nכולנו חייבים להשתתף בסדנת האבטחה ביום שני 22.1.2024 בשעה 09:00-17:00 במרכז ההדרכה ברמת גן. ביום רביעי 24.1.2024 נקיים demo day פנימי בשעה 14:00 שבו כל צוות יציג את התקדמותו.\n\nהבנק בוחן שתי הצעות נוספות ממתחרים, ורק אם נעמוד בלוחות הזמנים נזכה בחוזה הרב-שנתי של 50 מיליון שקל.\n\nתיאום: פגישות daily standup בשעה 09:00, ניהול משימות ב-Jira, תקשורת דחופה ב-Slack channel #bank-project-critical.\n\nאני זמין 24/7 בטלפון 050-1234567 או בSlack.\n\nבהצלחה לכולנו!\nעמית הרן, מנהל פרויקטים ראשי",
      "extracted_tasks": [
        {
          "sender": "amit.haran@fintech-innovations.co.il",
          "sending_date": "2024-01-20",
          "assigned_to": "מיכל",
          "title": "השלמת ממשקי משתמש",
          "description": "השלמת כל ממשקי המשתמש עד יום חמישי 25.1.2024 בשעה 17:00. הדרישות כוללות עיצוב מחדש של מסך הכניסה עם אבטחה ביומטרית, ממשק ההעברות החדש עם אישור דו-שלבי, דשבורד המציג יתרות וגרפים, מסכי הלוואות וחיסכון עם חישובי ריבית דינמיים, וממשק לשירותי לקוחות עם צ'אט בוט חכם. כל הממשקים צריכים להיות responsive ותואמים ל-WCAG 2.1.",
          "due_date": "2024-01-25"
        },
        {
          "sender": "amit.haran@fintech-innovations.co.il",
          "sending_date": "2024-01-20",
          "assigned_to": "עדי",
          "title": "השלמת איקונוגרפיה ומערכת צבעים",
          "description": "השלמת האיקונוגרפיה החדשה ומערכת הצבעים עד יום רביעי 24.1.2024, ויכין prototypes אינטראקטיביים ב-Figma לכל התהליכים המרכזיים.",
          "due_date": "2024-01-24"
        },
        {
          "sender": "amit.haran@fintech-innovations.co.il",
          "sending_date": "2024-01-20",
          "assigned_to": "דוד",
          "title": "טיפול בארכיטקטורה הטכנית ופיתוח ה-API החדש",
          "description": "טיפול בארכיטקטורה הטכנית ופיתוח ה-API החדש עד יום ראשון 28.1.2024. הוא יצטרך לבנות REST API עם אבטחת OAuth 2.0, WebSocket connections למעקב real-time, מיקרו-שירותים לחיבור למערכות הבנק, מערכת notifications עם Firebase, ואלגוריתמי ML לזיהוי עסקאות חשודות.",
          "due_date": "2024-01-28"
        },
        {
          "sender": "amit.haran@fintech-innovations.co.il",
          "sending_date": "2024-01-20",
          "assigned_to": "תמר",
          "title": "טיפול בצד הקליינט React Native",
          "description": "טיפול בצד הקליינט React Native ותבטיח אינטגרציה מלאה עד יום שישי 26.1.2024. התפקיד שלה יכלול פיתוח רכיבי UI מותאמים אישית, מנגנון caching חכם, הטמעת התחברות ביומטרית, וטיפול בחריגות ומצבי שגיאה.",
          "due_date": "2024-01-26"
        },
        {
          "sender": "amit.haran@fintech-innovations.co.il",
          "sending_date": "2024-01-20",
          "assigned_to": "יונתן",
          "title": "טיפול במערכות האבטחה",
          "description": "היה אחראי על כל המערכות עד יום חמישי 25.1.2024. המשימות שלו כוללות הטמעת תקני PCI DSS, הגדרת מערכת logging עם ELK Stack, ביצוע בדיקות penetration testing, והגדרת CI/CD pipeline עם Docker ו-Kubernetes.",
          "due_date": "2024-01-25"
        },
        {
          "sender": "amit.haran@fintech-innovations.co.il",
          "sending_date": "2024-01-20",
          "assigned_to": "שרה",
          "title": "הכנת מצגת לדירקטוריון",
          "description": "הכנת מצגת מקיפה לדירקטוריון עד מחר 21.1.2024 בשעה 10:00. המצגת חייבת לכלול אבני דרך מפורטות, ניתוח תחרותי של אפליקציות בנקאיות מובילות, תחזיות הכנסות ו-ROI, אסטרטגיית שיווק ורכישת לקוחות, וניתוח סיכונים.",
          "due_date": "2024-01-21"
        },
        {
          "sender": "amit.haran@fintech-innovations.co.il",
          "sending_date": "2024-01-20",
          "assigned_to": "רועי",
          "title": "הכנת תוכנית בדיקות מקיפה",
          "description": "הכנת תוכנית בדיקות מקיפה עד יום רביעי 24.1.2024, כולל test cases לכל התהליכים העסקיים, תרחישי עומס עד 100,000 משתמשים במקביל, בדיקות אבטחה, ומדריכי QA.",
          "due_date": "2024-01-24"
        }
      ],
      "num_tasks_extracted": 7,
      "score": 100,
      "judgment": "ציון: 100\nנקודות חולשה: אין\nהמשימות הקיימות במייל:\n[\n  {\n    \"sender\": \"amit.haran@fintech-innovations.co.il\",\n    \"sending_date\": \"2024-01-20\",\n    \"assigned_to\": \"מיכל\",\n    \"title\": \"השלמת ממשקי משתמש\",\n    \"description\": \"השלמת כל ממשקי המשתמש עד יום חמישי 25.1.2024 בשעה 17:00. הדרישות כוללות עיצוב מחדש של מסך הכניסה עם אבטחה ביומטרית, ממשק ההעברות החדש עם אישור דו-שלבי, דשבורד המציג יתרות וגרפים, מסכי הלוואות וחיסכון עם חישובי ריבית דינמיים, וממשק לשירותי לקוחות עם צ'אט בוט חכם. כל הממשקים צריכים להיות responsive ותואמים ל-WCAG 2.1.\",\n    \"due_date\": \"2024-01-25\"\n  },\n  {\n    \"sender\": \"amit.haran@fintech-innovations.co.il\",\n    \"sending_date\": \"2024-01-20\",\n    \"assigned_to\": \"עדי\",\n    \"title\": \"השלמת איקונוגרפיה ומערכת צבעים\",\n    \"description\": \"השלמת האיקונוגרפיה החדשה ומערכת הצבעים עד יום רביעי 24.1.2024, ויכין prototypes אינטראקטיביים ב-Figma לכל התהליכים המרכזיים.\",\n    \"due_date\": \"2024-01-24\"\n  },\n  {\n    \"sender\": \"amit.haran@fintech-innovations.co.il\",\n    \"sending_date\": \"2024-01-20\",\n    \"assigned_to\": \"דוד\",\n    \"title\": \"טיפול בארכיטקטורה הטכנית ופיתוח ה-API החדש\",\n    \"description\": \"טיפול בארכיטקטורה הטכנית ופיתוח ה-API החדש עד יום ראשון 28.1.2024. הוא יצטרך לבנות REST API עם אבטחת OAuth 2.0, WebSocket connections למעקב real-time, מיקרו-שירותים לחיבור למערכות הבנק, מערכת notifications עם Firebase, ואלגוריתמי ML לזיהוי עסקאות חשודות.\",\n    \"due_date\": \"2024-01-28\"\n  },\n  {\n    \"sender\": \"amit.haran@fintech-innovations.co.il\",\n    \"sending_date\": \"2024-01-20\",\n    \"assigned_to\": \"תמר\",\n    \"title\": \"טיפול בצד הקליינט React Native\",\n    \"description\": \"טיפול בצד הקליינט React Native ותבטיח אינטגרציה מלאה עד יום שישי 26.1.2024. התפקיד שלה יכלול פיתוח רכיבי UI מותאמים אישית, מנגנון caching חכם, הטמעת התחברות ביומטרית, וטיפול בחריגות ומצבי שגיאה.\",\n    \"due_date\": \"2024-01-26\"\n  },\n  {\n    \"sender\": \"amit.haran@fintech-innovations.co.il\",\n    \"sending_date\": \"2024-01-20\",\n    \"assigned_to\": \"יונתן\",\n    \"title\": \"טיפול במערכות האבטחה\",\n    \"description\": \"היה אחראי על כל המערכות עד יום חמישי 25.1.2024. המשימות שלו כוללות הטמעת תקני PCI DSS, הגדרת מערכת logging עם ELK Stack, ביצוע בדיקות penetration testing, והגדרת CI/CD pipeline עם Docker ו-Kubernetes.\",\n    \"due_date\": \"2024-01-25\"\n  },\n  {\n    \"sender\": \"amit.haran@fintech-innovations.co.il\",\n    \"sending_date\": \"2024-01-20\",\n    \"assigned_to\": \"שרה\",\n    \"title\": \"הכנת מצגת לדירקטוריון\",\n    \"description\": \"הכנת מצגת מקיפה לדירקטוריון עד מחר 21.1.2024 בשעה 10:00. המצגת חייבת לכלול אבני דרך מפורטות, ניתוח תחרותי של אפליקציות בנקאיות מובילות, תחזיות הכנסות ו-ROI, אסטרטגיית שיווק ורכישת לקוחות, וניתוח סיכונים.\",\n    \"due_date\": \"2024-01-21\"\n  },\n  {\n    \"sender\": \"amit.haran@fintech-innovations.co.il\",\n    \"sending_date\": \"2024-01-20\",\n    \"assigned_to\": \"רועי\",\n    \"title\": \"הכנת תוכנית בדיקות מקיפה\",\n    \"description\": \"הכנת תוכנית בדיקות מקיפה עד יום רביעי 24.1.2024, כולל test cases לכל התהליכים העסקיים, תרחישי עומס עד 100,000 משתמשים במקביל, בדיקות אבטחה, ומדריכי QA.\",\n    \"due_date\": \"2024-01-24\"\n  }\n]\n",
      "model_used": "gpt-3.5-turbo"
    },
    {
      "email_id": "multiple_tasks_same_person",
      "description": "Email with multiple tasks to the same person",
      "format_valid": true,
      "validation_message": "Valid format",
      "email_content": "נשלח: 2024-02-10 11:15\nמאת: uri.ceo@tech-startup.co.il\nאל: rotem.analyst@tech-startup.co.il\nעותק: management-team@tech-startup.co.il\nנושא: [קריטי] משימות לקראת סיבוב השקעות Series B\n\nשלום רותם,\n\nלאור הפגישה המכרעת שלנו עם קרן ההשקעות הבינלאומית בשבוע הבא, אני צריך ממך לבצע מספר משימות קריטיות. הקרן בוחנת השקעה של 25 מיליון דולר בחברה, והכל תלוי בחומרים שתכין.\n\nעליך להשלים את הדוח הפיננסי השנתי המקיף עד מחר בבוקר בשעה 08:00. הדוח חייב לכלול ניתוח תזרים מזומנים לשנתיים האחרונות, השוואה מפורטת לחברות דומות בתחום, תחזיות צמיחה לחמש השנים הבאות, פרטים על כל ההשקעות והוצאות המחקר, וניתוח סיכונים פיננסיים ואסטרטגיים. זה הדוח הקריטי ביותר ואסור שיהיו בו טעויות!\n\nבנוסף, צריך לארגן פגישת הכרות עם הלקוח החדש מיפן בעוד יומיים (12.2.2024) בשעה 15:00. זה לקוח אסטרטגי בשווי 10 מיליון דולר בשנה, ואתה צריך לתאם שכירת אולם ישיבות מפואר במלון דן תל-אביב, הזמנת מתרגם יפנית-עברית מקצועי, הכנת חבילת מתנות קורפורטיביות, הזמנת קייטרינג כשר ומתאים לתרבות יפנית, וארגון הובלה מהנמל התעופה.\n\nהכן גם מצגת מקיפה למשקיעים עד השבוע הבא ביום שני (19.2.2024) בשעה 09:00. המצגת צריכה לכלול סיכום ביצועי החברה ב-18 החודשים האחרונים, תוכנית עבודה מפורטת לשלוש השנים הבאות, ניתוח שוק מקיף של תחום ה-AI והמתחרים, תחזיות ROI ויעדי צמיחה אגרסיביים, פרטים על הצוות הניהולי והטכני, roadmap טכנולוגי ואסטרטגיית פיתוח מוצרים, ותוכנית שיווק בינלאומית ופריסה לשווקים חדשים. המצגת צריכה להיות ברמה של Goldman Sachs!\n\nתתאם עם צוות השיווק לקמפיין השקת המוצר החדש בעוד שלושה ימים (13.2.2024). זה הקמפיין שיקבע אם נגיע ליעד של מיליון משתמשים השנה.\n\nיש לך תקציב פתוח של 500,000 שקל לכל ההוצאות הנדרשות. זה הרגע הקריטי ביותר בתולדות החברה.\n\nאתה זמין אלי 24/7 בטלפון 050-9876543 או ב-WhatsApp.\n\nבהצלחה ובברכה,\nאורי רון\nמנכ\"ל ומייסד שותף",
      "extracted_tasks": [
        {
          "sender": "uri.ceo@tech-startup.co.il",
          "sending_date": "2024-02-10",
          "assigned_to": "רותם",
          "title": "השלמת דוח פיננסי שנתי מקיף",
          "description": "השלם את הדוח הפיננסי השנתי המקיף עד מחר בבוקר בשעה 08:00. הדוח חייב לכלול ניתוח תזרים מזומנים לשנתיים האחרונות, השוואה מפורטת לחברות דומות בתחום, תחזיות צמיחה לחמש השנים הבאות, פרטים על כל ההשקעות והוצאות המחקר, וניתוח סיכונים פיננסיים ואסטרטגיים.",
          "due_date": "2024-02-11"
        },
        {
          "sender": "uri.ceo@tech-startup.co.il",
          "sending_date": "2024-02-10",
          "assigned_to": "רותם",
          "title": "ארגון פגישת הכרות עם לקוח יפני חדש",
          "description": "ארגן פגישת הכרות עם הלקוח החדש מיפן בעוד יומיים (12.2.2024) בשעה 15:00. זה לקוח אסטרטגי בשווי 10 מיליון דולר בשנה, ואתה צריך לתאם שכירת אולם ישיבות מפואר במלון דן תל-אביב, הזמנת מתרגם יפנית-עברית מקצועי, הכנת חבילת מתנות קורפורטיביות, הזמנת קייטרינג כשר ומתאים לתרבות יפנית, וארגון הובלה מהנמל התעופה.",
          "due_date": "2024-02-12"
        },
        {
          "sender": "uri.ceo@tech-startup.co.il",
          "sending_date": "2024-02-10",
          "assigned_to": "רותם",
          "title": "הכנת מצגת מקיפה למשקיעים",
          "description": "הכן מצגת מקיפה למשקיעים עד השבוע הבא ביום שני (19.2.2024) בשעה 09:00. המצגת צריכה לכלול סיכום ביצועי החברה ב-18 החודשים האחרונים, תוכנית עבודה מפורטת לשלוש השנים הבאות, ניתוח שוק מקיף של תחום ה-AI והמתחרים, תחזיות ROI ויעדי צמיחה אגרסיביים, פרטים על הצוות הניהולי והטכני, roadmap טכנולוגי ואסטרטגיית פיתוח מוצרים, ותוכנית שיווק בינלאומית ופריסה לשווקים חדשים.",
          "due_date": "2024-02-19"
        },
        {
          "sender": "uri.ceo@tech-startup.co.il",
          "sending_date": "2024-02-10",
          "assigned_to": "רותם",
          "title": "תיאום עם צוות השיווק לקמפיין השקת המוצר החדש",
          "description": "תתאם עם צוות השיווק לקמפיין השקת המוצר החדש בעוד שלושה ימים (13.2.2024). זה הקמפיין שיקבע אם נגיע ליעד של מיליון משתמשים השנה.",
          "due_date": "2024-02-13"
        }
      ],
      "num_tasks_extracted": 4,
      "score": 100,
      "judgment": "ציון: 100\nנקודות חולשה: אין\nהמשימות הקיימות במייל:\n[\n  {\n    \"sender\": \"uri.ceo@tech-startup.co.il\",\n    \"sending_date\": \"2024-02-10\",\n    \"assigned_to\": \"רותם\",\n    \"title\": \"השלמת דוח פיננסי שנתי מקיף\",\n    \"description\": \"השלם את הדוח הפיננסי השנתי המקיף עד מחר בבוקר בשעה 08:00. הדוח חייב לכלול ניתוח תזרים מזומנים לשנתיים האחרונות, השוואה מפורטת לחברות דומות בתחום, תחזיות צמיחה לחמש השנים הבאות, פרטים על כל ההשקעות והוצאות המחקר, וניתוח סיכונים פיננסיים ואסטרטגיים.\",\n    \"due_date\": \"2024-02-11\"\n  },\n  {\n    \"sender\": \"uri.ceo@tech-startup.co.il\",\n    \"sending_date\": \"2024-02-10\",\n    \"assigned_to\": \"רותם\",\n    \"title\": \"ארגון פגישת הכרות עם לקוח יפני חדש\",\n    \"description\": \"ארגן פגישת הכרות עם הלקוח החדש מיפן בעוד יומיים (12.2.2024) בשעה 15:00. זה לקוח אסטרטגי בשווי 10 מיליון דולר בשנה, ואתה צריך לתאם שכירת אולם ישיבות מפואר במלון דן תל-אביב, הזמנת מתרגם יפנית-עברית מקצועי, הכנת חבילת מתנות קורפורטיביות, הזמנת קייטרינג כשר ומתאים לתרבות יפנית, וארגון הובלה מהנמל התעופה.\",\n    \"due_date\": \"2024-02-12\"\n  },\n  {\n    \"sender\": \"uri.ceo@tech-startup.co.il\",\n    \"sending_date\": \"2024-02-10\",\n    \"assigned_to\": \"רותם\",\n    \"title\": \"הכנת מצגת מקיפה למשקיעים\",\n    \"description\": \"הכן מצגת מקיפה למשקיעים עד השבוע הבא ביום שני (19.2.2024) בשעה 09:00. המצגת צריכה לכלול סיכום ביצועי החברה ב-18 החודשים האחרונים, תוכנית עבודה מפורטת לשלוש השנים הבאות, ניתוח שוק מקיף של תחום ה-AI והמתחרים, תחזיות ROI ויעדי צמיחה אגרסיביים, פרטים על הצוות הניהולי והטכני, roadmap טכנולוגי ואסטרטגיית פיתוח מוצרים, ותוכנית שיווק בינלאומית ופריסה לשווקים חדשים.\",\n    \"due_date\": \"2024-02-19\"\n  },\n  {\n    \"sender\": \"uri.ceo@tech-startup.co.il\",\n    \"sending_date\": \"2024-02-10\",\n    \"assigned_to\": \"רותם\",\n    \"title\": \"תיאום עם צוות השיווק לקמפיין השקת המוצר החדש\",\n    \"description\": \"תתאם עם צוות השיווק לקמפיין השקת המוצר החדש בעוד שלושה ימים (13.2.2024). זה הקמפיין שיקבע אם נגיע ליעד של מיליון משתמשים השנה.\",\n    \"due_date\": \"2024-02-13\"\n  }\n]\n",
      "model_used": "gpt-3.5-turbo"
    },
    {
      "email_id": "unclear_assignment",
      "description": "Email with unclear task assignments",
      "format_valid": true,
      "validation_message": "Valid format",
      "email_content": "נשלח: 2024-03-05 08:42\nמאת: admin.operations@global-offices.com\nאל: all-staff@global-offices.com, it-support@global-offices.com, facilities@global-offices.com\nנושא: [דחוף] בעיות תפעוליות קריטיות במתחם המשרדים הראשי\n\nלכל הצוות היקר,\n\nאחרי בדיקה מקיפה שביצעתי השבוע, אני צריך לדווח על מספר בעיות חמורות בתשתית המשרדים שלנו, שעלולות להוריד משמעותית את הפרודוקטיביות.\n\nמדפסת HP LaserJet Pro בקומה השנייה (במחלקת המכירות) לא עובדת כבר שלושה ימים רצופים. המדפסת מציגה שגיאת \"Paper Jam\" במקום שאין בו נייר תקוע. זה נוגע לעשרות עובדים שצריכים להדפיס דוחות חשובים ללקוחות. מישהו צריך לקרוא לטכנאי מקצועי מחברת HP או לחלופין לבדוק אם זה משהו שאפשר לתקן בעצמנו.\n\nמדפסת ה-Canon ImageClass במחלקת הנהלת חשבונות מדפיסה עם קווים וכתמים. נדמה לי שזה בעית קרטריג'ים או טונרים, אבל אין לי ודאות. המחלקה צריכה את המדפסת הזו באופן דחוף כי הם עוסקים בהכנת דוחות רבעוניים שצריכים להיות מוגשים לרשויות המס בשבוע הבא.\n\nהאינטרנט בכל המשרד איטי מאוד השבוע - קצב ההורדה ירד מ-100 מגאביט ל-15 מגאביט, ויש הפסקות תדירות. העניין הזה פוגע בווידאו-קונפרנסים עם לקוחות בחול, בניסיונות להעלות קבצים כבדים לשרת, ובעבודה עם מערכות CRM ו-ERP שלנו. אולי צריך לבדוק עם ספק האינטרנט שלנו (בזק בינלאומי)? או אולי זה משהו בצד שלנו שצריך לבדוק?\n\nהטלפונים הקווים בקומה השלישית לא עובדים כמו שצריך. הקול מקוטע באמצע שיחות, ויש רעשים מזיקים בקו. העניין הזה יוצר בעיות בתקשורת עם לקוחות וספקים.\n\nמערכת המיזוג במשרד של המנהלים (קומה רביעית) לא עובדת טוב - בדרך כלל היא קרה מדי בחורף וחמה מדי בקיץ. יש רעשים מזיקים שמגיעים מכיוון המזגן, והחלק הדרומי של המשרד תמיד חם מדי. המנהלים לא מרוצים וזה פוגע במורל. חייבים לתקן את זה לפני שהקיץ יתחיל באמת.\n\nבנוסף לכל הבעיות האלה, אנחנו צריכים לעדכן את תוכנת האנטי-וירוס בכל המחשבים בבניין. יש לנו כ-150 עמדות עבודה בבניין. אני לא בטוח מתי היה העדכון האחרון ואם אנחנו מוגנים מפני התקפות סייבר חדשות.\n\nאני יודע שזו רשימה ארוכה של בעיות, אבל כל אחת מהן משפיעה על הפעילות היומיומית של החברה. מי יכול לטפל בכל אחד מהעניינים האלה? אני צריך לדעת מי אחראי על כל בעיה ולוח זמנים לפתרון.\n\nבכבוד רב,\nמשה כהן\nמנהל תפעול",
      "extracted_tasks": [
        {
          "sender": "admin.operations@global-offices.com",
          "sending_date": "2024-03-05",
          "assigned_to": "מישהו",
          "title": "בדיקת מדפסת HP LaserJet Pro בקומה השנייה",
          "description": "לקרוא לטכנאי מקצועי מחברת HP או לבדוק אם ניתן לתקן את המדפסת בעצמנו. המדפסת מציגה שגיאת \"Paper Jam\" במקום שאין בו נייר תקוע. זה נוגע לעשרות עובדים שצריכים להדפיס דוחות חשובים ללקוחות.",
          "due_date": null
        },
        {
          "sender": "admin.operations@global-offices.com",
          "sending_date": "2024-03-05",
          "assigned_to": "מישהו",
          "title": "בדיקת מדפסת Canon ImageClass במחלקת הנהלת חשבונות",
          "description": "לבדוק את קרטריג'ים או טונרים של מדפסת ה-Canon ImageClass. המחלקה צריכה את המדפסת הזו באופן דחוף כי הם עוסקים בהכנת דוחות רבעוניים שצריכים להיות מוגשים לרשויות המס בשבוע הבא.",
          "due_date": "2024-03-11"
        },
        {
          "sender": "admin.operations@global-offices.com",
          "sending_date": "2024-03-05",
          "assigned_to": "מישהו",
          "title": "בדיקת אינטרנט",
          "description": "לבדוק את האינטרנט עם ספק האינטרנט (בזק בינלאומי) או לבדוק בעיות בצד שלנו.",
          "due_date": null
        },
        {
          "sender": "admin.operations@global-offices.com",
          "sending_date": "2024-03-05",
          "assigned_to": "מישהו",
          "title": "בדיקת טלפונים קווים בקומה השלישית",
          "description": "לתקן את הטלפונים הקווים בקומה השלישית - הקול מקוטע באמצע שיחות ויש רעשים מזיקים בקו.",
          "due_date": null
        },
        {
          "sender": "admin.operations@global-offices.com",
          "sending_date": "2024-03-05",
          "assigned_to": "מישהו",
          "title": "תיקון מערכת מיזוג במשרד המנהלים",
          "description": "לתקן את מערכת המיזוג במשרד המנהלים (קומה רביעית) לפני שהקיץ יתחיל.",
          "due_date": null
        },
        {
          "sender": "admin.operations@global-offices.com",
          "sending_date": "2024-03-05",
          "assigned_to": "מישהו",
          "title": "עדכון תוכנת אנטי-וירוס",
          "description": "לעדכן את תוכנת האנטי-וירוס בכל המחשבים בבניין (כ-150 עמדות עבודה).",
          "due_date": null
        }
      ],
      "num_tasks_extracted": 6,
      "score": 100,
      "judgment": "ציון: 100\nנקודות חולשה: אין\nהמשימות הקיימות במייל:\n[\n  {\n    \"sender\": \"admin.operations@global-offices.com\",\n    \"sending_date\": \"2024-03-05\",\n    \"assigned_to\": \"מישהו\",\n    \"title\": \"בדיקת מדפסת HP LaserJet Pro בקומה השנייה\",\n    \"description\": \"לקרוא לטכנאי מקצועי מחברת HP או לבדוק אם ניתן לתקן את המדפסת בעצמנו. המדפסת מציגה שגיאת \\\"Paper Jam\\\" במקום שאין בו נייר תקוע. זה נוגע לעשרות עובדים שצריכים להדפיס דוחות חשובים ללקוחות.\",\n    \"due_date\": null\n  },\n  {\n    \"sender\": \"admin.operations@global-offices.com\",\n    \"sending_date\": \"2024-03-05\",\n    \"assigned_to\": \"מישהו\",\n    \"title\": \"בדיקת מדפסת Canon ImageClass במחלקת הנהלת חשבונות\",\n    \"description\": \"לבדוק את קרטריג'ים או טונרים של מדפסת ה-Canon ImageClass. המחלקה צריכה את המדפסת הזו באופן דחוף כי הם עוסקים בהכנת דוחות רבעוניים שצריכים להיות מוגשים לרשויות המס בשבוע הבא.\",\n    \"due_date\": \"2024-03-11\"\n  },\n  {\n    \"sender\": \"admin.operations@global-offices.com\",\n    \"sending_date\": \"2024-03-05\",\n    \"assigned_to\": \"מישהו\",\n    \"title\": \"בדיקת אינטרנט\",\n    \"description\": \"לבדוק את האינטרנט עם ספק האינטרנט (בזק בינלאומי) או לבדוק בעיות בצד שלנו.\",\n    \"due_date\": null\n  },\n  {\n    \"sender\": \"admin.operations@global-offices.com\",\n    \"sending_date\": \"2024-03-05\",\n    \"assigned_to\": \"מישהו\",\n    \"title\": \"בדיקת טלפונים קווים בקומה השלישית\",\n    \"description\": \"לתקן את הטלפונים הקווים בקומה השלישית - הקול מקוטע באמצע שיחות ויש רעשים מזיקים בקו.\",\n    \"due_date\": null\n  },\n  {\n    \"sender\": \"admin.operations@global-offices.com\",\n    \"sending_date\": \"2024-03-05\",\n    \"assigned_to\": \"מישהו\",\n    \"title\": \"תיקון מערכת מיזוג במשרד המנהלים\",\n    \"description\": \"לתקן את מערכת המיזוג במשרד המנהלים (קומה רביעית) לפני שהקיץ יתחיל.\",\n    \"due_date\": null\n  },\n  {\n    \"sender\": \"admin.operations@global-offices.com\",\n    \"sending_date\": \"2024-03-05\",\n    \"assigned_to\": \"מישהו\",\n    \"title\": \"עדכון תוכנת אנטי-וירוס\",\n    \"description\": \"לעדכן את תוכנת האנטי-וירוס בכל המחשבים בבניין (כ-150 עמדות עבודה).\",\n    \"due_date\": null\n  }\n]\n",
      "model_used": "gpt-3.5-turbo"
    },
    {
      "email_id": "missing_sender_info",
      "description": "Email with missing or unclear sender information",
      "format_valid": true,
      "validation_message": "Valid format",
      "email_content": "נושא: [שחרור בטא] משימות קריטיות לצוות הפיתוח - פרויקט האפליקציה הניידת\n\nלצוות הפיתוח המתוקדם,\n\nבעקבות ההחלטה של הדירקטוריון לקדם את שחרור הבטא של האפליקציה הניידת לתחילת הרבעון השני, אנו צריכים לבצע מספר משימות קריטיות בלוחות זמנים צפופים ביותר. זו אפליקציה אסטרטגית שתשרת מעל 500,000 משתמשים ברחבי העולם, והצלחתה מהווה את נקודת המפנה של החברה. התקציב הכולל לפרויקט עומד על 18 מיליון שקל.\n\nליאור לוי (מפתח Backend בכיר) - תסיים את תיקון הבאגים הקריטיים במערכת ה-authentication עד יום רביעי בשעה 16:00. זה כולל תיקון בעיית JWT token expiration שגורמת למשתמשים להיזרק כל 15 דקות, פתרון בעיית המאשר הכפול במערכת OAuth 2.0, הטמעת מנגנון rate limiting למניעת brute force attacks, שיפור ביצועי המערכת למעל מ-50,000 בקשות בשניה, והוספת logging מקיף למעקב אחר התקפות אבטחה. הבאגים האלה גורמים כרגע לפניות לקוחות ולאיבוד כספים!\n\nמיה רוזנברג (מנהלת QA ודוקומנטציה) - את צריכה לעדכן ולהשלים את הדוקומנטציה הטכנית ל-API החדש עד יום ששי בשעה 14:00. הדוקומנטציה חייבת לכלול תיעוד מלא של כל 247 endpoints החדשים, דוגמאות JSON לכל request ו-response, קודי שגיאה מפורטים וטיפול בחריגות, דיאגרמות זרימה לכל תהליך עסקי, מדריכי אינטגרציה למפתחים חיצוניים, ותרגומים לאנגלית וספרדית לשוקים בינלאומיים. הדוקומנטציה הזו קריטית לקבלת אישור מרשויות הרגולציה!\n\nכולם מצוות הפיתוח (ליאור, מיה, רון, דני, אלון, ניר, יונתן וטלי) - אתם חייבים לעבור על כל הקוד הקיים ולעשות code review מקיף לפני השחרור לבטא. ה-deadline החד הוא סוף השבוע (שבת בצהרים). בנוסף, יש לעדכן בסיס הנתונים לגרסה חדשה של PostgreSQL 15 וכל הקוד חייב לעבור בדיקות אבטחה עם SonarQube ו-OWASP ZAP.\n\nהשחרור לבטא מתוכנן ל-15 באפריל 2024. יש לנו חלון זמן צר מאוד וכל עיכוב עלול להשפיע על שחרור הגרסה המלאה ביוני.\n\n---\nהודעה זו נשלחה אוטומטית ממערכת ניהול הפרויקטים המרכזית\nלשאלות או הערות, צרו קשר עם צוות ניהול הפרויקטים\nTech Solutions Ltd. | Project Management Division",
      "extracted_tasks": [
        {
          "sender": "ליאור לוי",
          "sending_date": "2025-08-06",
          "assigned_to": "ליאור לוי",
          "title": "תיקון באגים קריטיים במערכת ה-authentication",
          "description": "תסיים את תיקון הבאגים הקריטיים במערכת ה-authentication עד יום רביעי בשעה 16:00. זה כולל תיקון בעיית JWT token expiration שגורמת למשתמשים להיזרק כל 15 דקות, פתרון בעיית המאשר הכפול במערכת OAuth 2.0, הטמעת מנגנון rate limiting למניעת brute force attacks, שיפור ביצועי המערכת למעל מ-50,000 בקשות בשניה, והוספת logging מקיף למעקב אחר התקפות אבטחה.",
          "due_date": "2025-08-07"
        },
        {
          "sender": "מיה רוזנברג",
          "sending_date": "2025-08-06",
          "assigned_to": "מיה רוזנברג",
          "title": "עדכון והשלמת הדוקומנטציה הטכנית ל-API החדש",
          "description": "את צריכה לעדכן ולהשלים את הדוקומנטציה הטכנית ל-API החדש עד יום ששי בשעה 14:00. הדוקומנטציה חייבת לכלול תיעוד מלא של כל 247 endpoints החדשים, דוגמאות JSON לכל request ו-response, קודי שגיאה מפורטים וטיפול בחריגות, דיאגרמות זרימה לכל תהליך עסקי, מדריכי אינטגרציה למפתחים חיצוניים, ותרגומים לאנגלית וספרדית לשוקים בינלאומיים.",
          "due_date": "2025-08-08"
        }
      ],
      "num_tasks_extracted": 2,
      "score": 100,
      "judgment": "ציון: 100\nנקודות חולשה: אין\nהמשימות הקיימות במייל:\n[\n  {\n    \"sender\": \"ליאור לוי\",\n    \"sending_date\": \"2025-08-06\",\n    \"assigned_to\": \"ליאור לוי\",\n    \"title\": \"תיקון באגים קריטיים במערכת ה-authentication\",\n    \"description\": \"תסיים את תיקון הבאגים הקריטיים במערכת ה-authentication עד יום רביעי בשעה 16:00. זה כולל תיקון בעיית JWT token expiration שגורמת למשתמשים להיזרק כל 15 דקות, פתרון בעיית המאשר הכפול במערכת OAuth 2.0, הטמעת מנגנון rate limiting למניעת brute force attacks, שיפור ביצועי המערכת למעל מ-50,000 בקשות בשניה, והוספת logging מקיף למעקב אחר התקפות אבטחה.\",\n    \"due_date\": \"2025-08-07\"\n  },\n  {\n    \"sender\": \"מיה רוזנברג\",\n    \"sending_date\": \"2025-08-06\",\n    \"assigned_to\": \"מיה רוזנברג\",\n    \"title\": \"עדכון והשלמת הדוקומנטציה הטכנית ל-API החדש\",\n    \"description\": \"את צריכה לעדכן ולהשלים את הדוקומנטציה הטכנית ל-API החדש עד יום ששי בשעה 14:00. הדוקומנטציה חייבת לכלול תיעוד מלא של כל 247 endpoints החדשים, דוגמאות JSON לכל request ו-response, קודי שגיאה מפורטים וטיפול בחריגות, דיאגרמות זרימה לכל תהליך עסקי, מדריכי אינטגרציה למפתחים חיצוניים, ותרגומים לאנגלית וספרדית לשוקים בינלאומיים.\",\n    \"due_date\": \"2025-08-08\"\n  }\n]\n",
      "model_used": "gpt-3.5-turbo"
    },
    {
      "email_id": "complex_nested_tasks",
      "description": "Email with complex, nested tasks and sub-tasks",
      "format_valid": true,
      "validation_message": "Valid format",
      "email_content": "נשלח: 2024-04-12\nמאת: project.lead@company.co.il\nאל: team@company.co.il\nנושא: פרויקט האתר החדש - פילוח משימות\n\nצוות יקר,\n\nהפרויקט החדש של האתר דורש תכנון מדוקדק. הנה הפילוח:\n\nשלב א' - מחקר ותכנון (עד 20.4.2024):\nנועה תעשה מחקר משתמשים ותכין פרסונות. זה כולל גם עשרה ראיונות עם לקוחות קיימים ואנליזה מפורטת של שלושה מתחרים מובילים בשוק. בנוסף, היא תכין מפת משתמש מפורטת עם כל נקודות המגע הקריטיות ותגדיר personas לפחות לחמישה סוגי משתמשים שונים.\n\nשלב ב' - עיצוב (עד 30.4.2024):\nתום יעצב את כל הדפים, כולל responsive design לכל המכשירים. הוא צריך להכין wireframes לעשרים דפים עיקריים, להגדיר מערכת עיצוב אחידה עם קומפוננטים לשימוש חוזר, לעצב prototypes אינטראקטיביים עם אנימציות ומעברים, ולוודא שהעיצוב תואם לסטנדרטי נגישות WCAG 2.1. בנוסף, יצור style guide מפורט ויבצע בדיקות משתמשים עם לפחות עשרה משתתפים.\n\nשלב ג' - פיתוח (עד 15.5.2024):\nצוות הפיתוח (דנה, איתי ואלון) יפתחו את כל הפונקציונליות. דנה תתמקד ב-frontend עם React ו-TypeScript, תטמיע את כל הקומפוננטים מהעיצוב, תבטיח ביצועים מיטביים ותוסיף אנימציות חלקות. איתי יבנה את ה-backend עם Node.js ו-Express, יקים בסיס נתונים MongoDB, יכין API מלא עם authentication ו-authorization, ויטמיע מערכת caching מתקדמת. אלון יטפל בחיבורים לAPIים חיצוניים כולל תשלומים, אנליטיקס, ומערכות CRM, ויבנה מערכת ניטור וlogs מקיפה.\n\nבמקביל, כולנו צריכים להתכונן למצגת ללקוח ביום רביעי הבא. כל אחד יציג את החלק שלו - נועה תציג את ממצאי המחקר, תום יציג את הקונצפט העיצובי והמסלולים העיקריים, ודנה תציג demo פעיל של הפונקציונליות הבסיסית.\n\nבהצלחה!\nליאת רונן, ראש צוות",
      "extracted_tasks": [
        {
          "sender": "project.lead@company.co.il",
          "sending_date": "2024-04-12",
          "assigned_to": "נועה",
          "title": "מחקר משתמשים",
          "description": "לבצע מחקר משתמשים ולהכין פרסונות. זה כולל גם עשרה ראיונות עם לקוחות קיימים ואנליזה מפורטת של שלושה מתחרים מובילים בשוק. בנוסף, היא תכין מפת משתמש מפורטת עם כל נקודות המגע הקריטיות ותגדיר personas לפחות לחמישה סוגי משתמשים שונים.",
          "due_date": "2024-04-20"
        },
        {
          "sender": "project.lead@company.co.il",
          "sending_date": "2024-04-12",
          "assigned_to": "תום",
          "title": "עיצוב הדפים",
          "description": "לעצב את כל הדפים, כולל responsive design לכל המכשירים. הוא צריך להכין wireframes לעשרים דפים עיקריים, להגדיר מערכת עיצוב אחידה עם קומפוננטים לשימוש חוזר, לעצב prototypes אינטראקטיביים עם אנימציות ומעברים, ולוודא שהעיצוב תואם לסטנדרטי נגישות WCAG 2.1. בנוסף, יצור style guide מפורט ויבצע בדיקות משתמשים עם לפחות עשרה משתתפים.",
          "due_date": "2024-04-30"
        },
        {
          "sender": "project.lead@company.co.il",
          "sending_date": "2024-04-12",
          "assigned_to": "דנה",
          "title": "פיתוח Frontend",
          "description": "לפתח את ה-frontend עם React ו-TypeScript, לטמיע את כל הקומפוננטים מהעיצוב, להבטיח ביצועים מיטביים ולהוסיף אנימציות חלקות.",
          "due_date": "2024-05-15"
        },
        {
          "sender": "project.lead@company.co.il",
          "sending_date": "2024-04-12",
          "assigned_to": "איתי",
          "title": "פיתוח Backend",
          "description": "לבנות את ה-backend עם Node.js ו-Express, לקים בסיס נתונים MongoDB, להכין API מלא עם authentication ו-authorization, ולטמיע מערכת caching מתקדמת.",
          "due_date": "2024-05-15"
        },
        {
          "sender": "project.lead@company.co.il",
          "sending_date": "2024-04-12",
          "assigned_to": "אלון",
          "title": "חיבור ל-APIs חיצוניים",
          "description": "לטפל בחיבורים ל-APIים חיצוניים כולל תשלומים, אנליטיקס ומערכות CRM, ולבנות מערכת ניטור וlogs מקיפה.",
          "due_date": "2024-05-15"
        },
        {
          "sender": "project.lead@company.co.il",
          "sending_date": "2024-04-12",
          "assigned_to": "נועה",
          "title": "הצגת ממצאי המחקר",
          "description": "להציג את ממצאי המחקר במצגת ללקוח.",
          "due_date": "2024-04-17"
        },
        {
          "sender": "project.lead@company.co.il",
          "sending_date": "2024-04-12",
          "assigned_to": "תום",
          "title": "הצגת הקונצפט העיצובי",
          "description": "להציג את הקונצפט העיצובי והמסלולים העיקריים במצגת ללקוח.",
          "due_date": "2024-04-17"
        },
        {
          "sender": "project.lead@company.co.il",
          "sending_date": "2024-04-12",
          "assigned_to": "דנה",
          "title": "הצגת Demo פעיל",
          "description": "להציג demo פעיל של הפונקציונליות הבסיסית במצגת ללקוח.",
          "due_date": "2024-04-17"
        }
      ],
      "num_tasks_extracted": 8,
      "score": 100,
      "judgment": "ציון: 100\nנקודות חולשה: אין\nהמשימות הקיימות במייל:\n[\n  {\n    \"sender\": \"project.lead@company.co.il\",\n    \"sending_date\": \"2024-04-12\",\n    \"assigned_to\": \"נועה\",\n    \"title\": \"מחקר משתמשים\",\n    \"description\": \"לבצע מחקר משתמשים ולהכין פרסונות. זה כולל גם עשרה ראיונות עם לקוחות קיימים ואנליזה מפורטת של שלושה מתחרים מובילים בשוק. בנוסף, היא תכין מפת משתמש מפורטת עם כל נקודות המגע הקריטיות ותגדיר personas לפחות לחמישה סוגי משתמשים שונים.\",\n    \"due_date\": \"2024-04-20\"\n  },\n  {\n    \"sender\": \"project.lead@company.co.il\",\n    \"sending_date\": \"2024-04-12\",\n    \"assigned_to\": \"תום\",\n    \"title\": \"עיצוב הדפים\",\n    \"description\": \"לעצב את כל הדפים, כולל responsive design לכל המכשירים. הוא צריך להכין wireframes לעשרים דפים עיקריים, להגדיר מערכת עיצוב אחידה עם קומפוננטים לשימוש חוזר, לעצב prototypes אינטראקטיביים עם אנימציות ומעברים, ולוודא שהעיצוב תואם לסטנדרטי נגישות WCAG 2.1. בנוסף, יצור style guide מפורט ויבצע בדיקות משתמשים עם לפחות עשרה משתתפים.\",\n    \"due_date\": \"2024-04-30\"\n  },\n  {\n    \"sender\": \"project.lead@company.co.il\",\n    \"sending_date\": \"2024-04-12\",\n    \"assigned_to\": \"דנה\",\n    \"title\": \"פיתוח Frontend\",\n    \"description\": \"לפתח את ה-frontend עם React ו-TypeScript, לטמיע את כל הקומפוננטים מהעיצוב, להבטיח ביצועים מיטביים ולהוסיף אנימציות חלקות.\",\n    \"due_date\": \"2024-05-15\"\n  },\n  {\n    \"sender\": \"project.lead@company.co.il\",\n    \"sending_date\": \"2024-04-12\",\n    \"assigned_to\": \"איתי\",\n    \"title\": \"פיתוח Backend\",\n    \"description\": \"לבנות את ה-backend עם Node.js ו-Express, לקים בסיס נתונים MongoDB, להכין API מלא עם authentication ו-authorization, ולטמיע מערכת caching מתקדמת.\",\n    \"due_date\": \"2024-05-15\"\n  },\n  {\n    \"sender\": \"project.lead@company.co.il\",\n    \"sending_date\": \"2024-04-12\",\n    \"assigned_to\": \"אלון\",\n    \"title\": \"חיבור ל-APIs חיצוניים\",\n    \"description\": \"לטפל בחיבורים ל-APIים חיצוניים כולל תשלומים, אנליטיקס ומערכות CRM, ולבנות מערכת ניטור וlogs מקיפה.\",\n    \"due_date\": \"2024-05-15\"\n  },\n  {\n    \"sender\": \"project.lead@company.co.il\",\n    \"sending_date\": \"2024-04-12\",\n    \"assigned_to\": \"נועה\",\n    \"title\": \"הצגת ממצאי המחקר\",\n    \"description\": \"להציג את ממצאי המחקר במצגת ללקוח.\",\n    \"due_date\": \"2024-04-17\"\n  },\n  {\n    \"sender\": \"project.lead@company.co.il\",\n    \"sending_date\": \"2024-04-12\",\n    \"assigned_to\": \"תום\",\n    \"title\": \"הצגת הקונצפט העיצובי\",\n    \"description\": \"להציג את הקונצפט העיצובי והמסלולים העיקריים במצגת ללקוח.\",\n    \"due_date\": \"2024-04-17\"\n  },\n  {\n    \"sender\": \"project.lead@company.co.il\",\n    \"sending_date\": \"2024-04-12\",\n    \"assigned_to\": \"דנה\",\n    \"title\": \"הצגת Demo פעיל\",\n    \"description\": \"להציג demo פעיל של הפונקציונליות הבסיסית במצגת ללקוח.\",\n    \"due_date\": \"2024-04-17\"\n  }\n]\n",
      "model_used": "gpt-3.5-turbo"
    },
    {
      "email_id": "ambiguous_dates",
      "description": "Email with ambiguous or unclear dates",
      "format_valid": true,
      "validation_message": "Valid format",
      "email_content": "נשלח: 2024-05-08\nמאת: hr@company.com\nאל: all@company.com\nנושא: אירועים ומשימות קרובים\n\nשלום לכולם,\n\nיש כמה דברים חשובים שצריכים תשומת לב:\n\nמרים, את צריכה להגיש את הדוח השנתי \"בקרוב\". אני יודעת שזה לוקח זמן לאסוף את כל הנתונים מכל המחלקות ולעבד אותם, אבל זה ממש דחוף עכשיו.\n\nהמסיבה השנתית תתקיים \"בחודש הבא\" באולם הגדול. יעקב, תוכל לארגן את האולם ולתאם עם הקייטרינג? צריך לחשוב על תפריט למעל 200 איש.\n\nהשתלמות בטיחות חובה לכולם \"בימים הקרובים\". תמר תתאם את התאריכים עם החברה החיצונית ותשלח הזמנות לכולם. זה חובה לפי תקנות משרד העבודה.\n\nהערכות השנתיות צריכות להיות מוכנות \"לפני הקיץ\". כל מנהל צריך לסיים את הערכות הצוות שלו ולהגיש טופס מסכם. זה משפיע על הבונוסים השנתיים.\n\nביקורת פנימית מתוכננת \"בסוף הרבעון\". רחל, בבקשה תכיני את כל הדוחות הנדרשים מראש. המבקרים יבואו ליומיים שלמים ויבדקו הכל.\n\nבנוסף, אנחנו חושבים על יום כיף לעובדים \"מתישהו בקיץ\". אם יש לכם רעיונות או הצעות, אשמח לשמוע.\n\nתודה רבה!\nמחלקת משאבי אנוש",
      "extracted_tasks": [
        {
          "sender": "hr@company.com",
          "sending_date": "2024-05-08",
          "assigned_to": "מרים",
          "title": "הגשת הדוח השנתי",
          "description": "להגיש את הדוח השנתי \"בקרוב\". לאסוף את כל הנתונים מכל המחלקות ולעבד אותם.",
          "due_date": "2024-06-08"
        },
        {
          "sender": "hr@company.com",
          "sending_date": "2024-05-08",
          "assigned_to": "יעקב",
          "title": "ארגון המסיבה השנתית",
          "description": "לארגן את האולם ולתאם עם הקייטרינג. צריך לחשוב על תפריט למעל 200 איש.",
          "due_date": "2024-06-08"
        },
        {
          "sender": "hr@company.com",
          "sending_date": "2024-05-08",
          "assigned_to": "תמר",
          "title": "תיאום השתלמות בטיחות",
          "description": "לתאם את התאריכים עם החברה החיצונית ולשלוח הזמנות לכולם. זה חובה לפי תקנות משרד העבודה.",
          "due_date": "2024-05-15"
        },
        {
          "sender": "hr@company.com",
          "sending_date": "2024-05-08",
          "assigned_to": "רחל",
          "title": "הכנת דוחות לביקורת פנימית",
          "description": "להכין את כל הדוחות הנדרשים מראש. המבקרים יבואו ליומיים שלמים ויבדקו הכל.",
          "due_date": "2024-07-08"
        }
      ],
      "num_tasks_extracted": 4,
      "score": 100,
      "judgment": "ציון: 100\nנקודות חולשה: אין\nהמשימות הקיימות במייל:\n[\n  {\n    \"sender\": \"hr@company.com\",\n    \"sending_date\": \"2024-05-08\",\n    \"assigned_to\": \"מרים\",\n    \"title\": \"הגשת הדוח השנתי\",\n    \"description\": \"להגיש את הדוח השנתי \\\"בקרוב\\\". לאסוף את כל הנתונים מכל המחלקות ולעבד אותם.\",\n    \"due_date\": \"2024-06-08\"\n  },\n  {\n    \"sender\": \"hr@company.com\",\n    \"sending_date\": \"2024-05-08\",\n    \"assigned_to\": \"יעקב\",\n    \"title\": \"ארגון המסיבה השנתית\",\n    \"description\": \"לארגן את האולם ולתאם עם הקייטרינג. צריך לחשוב על תפריט למעל 200 איש.\",\n    \"due_date\": \"2024-06-08\"\n  },\n  {\n    \"sender\": \"hr@company.com\",\n    \"sending_date\": \"2024-05-08\",\n    \"assigned_to\": \"תמר\",\n    \"title\": \"תיאום השתלמות בטיחות\",\n    \"description\": \"לתאם את התאריכים עם החברה החיצונית ולשלוח הזמנות לכולם. זה חובה לפי תקנות משרד העבודה.\",\n    \"due_date\": \"2024-05-15\"\n  },\n  {\n    \"sender\": \"hr@company.com\",\n    \"sending_date\": \"2024-05-08\",\n    \"assigned_to\": \"רחל\",\n    \"title\": \"הכנת דוחות לביקורת פנימית\",\n    \"description\": \"להכין את כל הדוחות הנדרשים מראש. המבקרים יבואו ליומיים שלמים ויבדקו הכל.\",\n    \"due_date\": \"2024-07-08\"\n  }\n]",
      "model_used": "gpt-3.5-turbo"
    },
    {
      "email_id": "short_daily_email",
      "description": "Short email with a simple task",
      "format_valid": true,
      "validation_message": "Valid format",
      "email_content": "נשלח: 2024-05-28\nמאת: manager@company.com\nאל: dana@company.com\nנושא: ללא נושא\n\nהיי דנה,\n\nמחכה שתשלחי לי את מסמך האפיון שדיברנו עליו.",
      "extracted_tasks": [
        {
          "sender": "manager@company.com",
          "sending_date": "2024-05-28",
          "assigned_to": "dana@company.com",
          "title": "שליחת מסמך אפיון",
          "description": "שליחת מסמך האפיון שדיברנו עליו.",
          "due_date": null
        }
      ],
      "num_tasks_extracted": 1,
      "score": 100,
      "judgment": "ציון: 100\nנקודות חולשה: אין\nהמשימות הקיימות במייל:\n- שליחת מסמך אפיון: שליחת מסמך האפיון שדיברנו עליו.",
      "model_used": "gpt-3.5-turbo"
    },
    {
      "email_id": "urgent_multiple_deadlines",
      "description": "Email with multiple urgent tasks and tight deadlines",
      "format_valid": true,
      "validation_message": "Valid format",
      "email_content": "נשלח: 2024-07-22 09:30\nמאת: ceo@crisis.com\nאל: senior.team@crisis.com\nנושא: *** דחוף ביותר *** לקוח גדול מאיים לבטל חוזה - פעולה מיידית נדרשת!\n\nצוות ההנהלה,\n\nמצב קריטי! הלקוח הגדול שלנו שמהווה 50% מההכנסות השנתיות מאיים לבטל את החוזה בגלל בעיות שירות חמורות! צריך לפעול מיידית כדי למנוע אסון כלכלי:\n\nאלכס, תכין דוח מפורט ומקיף על כל הבעיות שהלקוח התלונן עליהם ב-24 השעות הקרובות בלבד. זה חייב לכלול גם פתרונות מוצעים קונקרטיים עם לוחות זמנים ברורים. הדוח הזה הוא הבסיס לכל מה שנעשה הלאה!\n\nמיקי, תתאמי פגישה דחופה עם מנכ\"ל הלקוח והצוות הבכיר שלו עד מחר בצהריים. אם לא ניתן למחר, אז ביום רביעי בבוקר בכל מקרה. תשכירי חדר ישיבות, תכיני מצגת התנצלות מקצועית, ותוודאי שכל מה שצריך יהיה מוכן.\n\nצוות הטכנולוגיה (דן, רעות, גיא), תתחילו לעבוד על תיקון כל הבאגים הקריטיים שהלקוח דיווח עליהם מיידית - עכשיו, היום! הכל צריך להיות מוכן ונבדק עד יום חמישי ב-17:00. אין אפשרות לדחייה!\n\nמחלקת השיווק תכין מצגת נזקים ופיצויים שנוכל להציע ללקוח עד יום רביעי ב-14:00. אנחנו צריכים להראות שאנחנו לוקחים את זה ברצינות מלאה.\n\nאנחנו נפגשים מחר בשעה 08:00 בדיוק לדווח על התקדמות. נוכחות חובה לכולם - ללא יוצא מן הכלל!\n\nזה לא רק קריטי לעתיד החברה - זה קובע אם יש לנו עתיד בכלל!\n\nאני סומך עליכם לעשות את הבלתי אפשרי.\n\nרועי בן-דוד, מנכ\"ל",
      "extracted_tasks": [
        {
          "sender": "ceo@crisis.com",
          "sending_date": "2024-07-22",
          "assigned_to": "אלכס",
          "title": "הכנת דוח מפורט על תלונות הלקוח",
          "description": "הכין דוח מפורט ומקיף על כל הבעיות שהלקוח התלונן עליהן ב-24 השעות הקרובות בלבד. הדוח צריך לכלול פתרונות מוצעים קונקרטיים עם לוחות זמנים ברורים.",
          "due_date": "2024-07-23"
        },
        {
          "sender": "ceo@crisis.com",
          "sending_date": "2024-07-22",
          "assigned_to": "מיקי",
          "title": "תיאום פגישה דחופה עם מנכ\"ל הלקוח",
          "description": "תאמי פגישה דחופה עם מנכ\"ל הלקוח והצוות הבכיר שלו עד מחר בצהריים. אם לא ניתן למחר, אז ביום רביעי בבוקר בכל מקרה. תשכירי חדר ישיבות, תכיני מצגת התנצלות מקצועית, ותוודאי שכל מה שצריך יהיה מוכן.",
          "due_date": "2024-07-23"
        },
        {
          "sender": "ceo@crisis.com",
          "sending_date": "2024-07-22",
          "assigned_to": "דן",
          "title": "תיקון באגים קריטיים",
          "description": "תתחילו לעבוד על תיקון כל הבאגים הקריטיים שהלקוח דיווח עליהם מיידית - עכשיו, היום! הכל צריך להיות מוכן ונבדק עד יום חמישי ב-17:00.",
          "due_date": "2024-07-25"
        },
        {
          "sender": "ceo@crisis.com",
          "sending_date": "2024-07-22",
          "assigned_to": "רעות",
          "title": "תיקון באגים קריטיים",
          "description": "תתחילו לעבוד על תיקון כל הבאגים הקריטיים שהלקוח דיווח עליהם מיידית - עכשיו, היום! הכל צריך להיות מוכן ונבדק עד יום חמישי ב-17:00.",
          "due_date": "2024-07-25"
        },
        {
          "sender": "ceo@crisis.com",
          "sending_date": "2024-07-22",
          "assigned_to": "גיא",
          "title": "תיקון באגים קריטיים",
          "description": "תתחילו לעבוד על תיקון כל הבאגים הקריטיים שהלקוח דיווח עליהם מיידית - עכשיו, היום! הכל צריך להיות מוכן ונבדק עד יום חמישי ב-17:00.",
          "due_date": "2024-07-25"
        },
        {
          "sender": "ceo@crisis.com",
          "sending_date": "2024-07-22",
          "assigned_to": "מחלקת השיווק",
          "title": "הכנת מצגת נזקים ופיצויים",
          "description": "תכין מצגת נזקים ופיצויים שנוכל להציע ללקוח עד יום רביעי ב-14:00. אנחנו צריכים להראות שאנחנו לוקחים את זה ברצינות מלאה.",
          "due_date": "2024-07-24"
        }
      ],
      "num_tasks_extracted": 6,
      "score": 100,
      "judgment": "ציון: 100\nנקודות חולשה: אין\nהמשימות הקיימות במייל:\n[\n  {\n    \"sender\": \"ceo@crisis.com\",\n    \"sending_date\": \"2024-07-22\",\n    \"assigned_to\": \"אלכס\",\n    \"title\": \"הכנת דוח מפורט על תלונות הלקוח\",\n    \"description\": \"הכין דוח מפורט ומקיף על כל הבעיות שהלקוח התלונן עליהן ב-24 השעות הקרובות בלבד. הדוח צריך לכלול פתרונות מוצעים קונקרטיים עם לוחות זמנים ברורים.\",\n    \"due_date\": \"2024-07-23\"\n  },\n  {\n    \"sender\": \"ceo@crisis.com\",\n    \"sending_date\": \"2024-07-22\",\n    \"assigned_to\": \"מיקי\",\n    \"title\": \"תיאום פגישה דחופה עם מנכ\\\"ל הלקוח\",\n    \"description\": \"תאמי פגישה דחופה עם מנכ\\\"ל הלקוח והצוות הבכיר שלו עד מחר בצהריים. אם לא ניתן למחר, אז ביום רביעי בבוקר בכל מקרה. תשכירי חדר ישיבות, תכיני מצגת התנצלות מקצועית, ותוודאי שכל מה שצריך יהיה מוכן.\",\n    \"due_date\": \"2024-07-23\"\n  },\n  {\n    \"sender\": \"ceo@crisis.com\",\n    \"sending_date\": \"2024-07-22\",\n    \"assigned_to\": \"דן\",\n    \"title\": \"תיקון באגים קריטיים\",\n    \"description\": \"תתחילו לעבוד על תיקון כל הבאגים הקריטיים שהלקוח דיווח עליהם מיידית - עכשיו, היום! הכל צריך להיות מוכן ונבדק עד יום חמישי ב-17:00.\",\n    \"due_date\": \"2024-07-25\"\n  },\n  {\n    \"sender\": \"ceo@crisis.com\",\n    \"sending_date\": \"2024-07-22\",\n    \"assigned_to\": \"רעות\",\n    \"title\": \"תיקון באגים קריטיים\",\n    \"description\": \"תתחילו לעבוד על תיקון כל הבאגים הקריטיים שהלקוח דיווח עליהם מיידית - עכשיו, היום! הכל צריך להיות מוכן ונבדק עד יום חמישי ב-17:00.\",\n    \"due_date\": \"2024-07-25\"\n  },\n  {\n    \"sender\": \"ceo@crisis.com\",\n    \"sending_date\": \"2024-07-22\",\n    \"assigned_to\": \"גיא\",\n    \"title\": \"תיקון באגים קריטיים\",\n    \"description\": \"תתחילו לעבוד על תיקון כל הבאגים הקריטיים שהלקוח דיווח עליהם מיידית - עכשיו, היום! הכל צריך להיות מוכן ונבדק עד יום חמישי ב-17:00.\",\n    \"due_date\": \"2024-07-25\"\n  },\n  {\n    \"sender\": \"ceo@crisis.com\",\n    \"sending_date\": \"2024-07-22\",\n    \"assigned_to\": \"מחלקת השיווק\",\n    \"title\": \"הכנת מצגת נזקים ופיצויים\",\n    \"description\": \"תכין מצגת נזקים ופיצויים שנוכל להציע ללקוח עד יום רביעי ב-14:00. אנחנו צריכים להראות שאנחנו לוקחים את זה ברצינות מלאה.\",\n    \"due_date\": \"2024-07-24\"\n  }\n]\n",
      "model_used": "gpt-3.5-turbo"
    }
  ],
  "timestamp": "2025-08-06T15:50:43.512504"
}